{
  "$schema": "../schema/modulo.schema.json",
  "id": "fin",
  "nome": "Fin / Pow",
  "agente": {
    "id": "fin",
    "nome": "Fin/Pow",
    "papel": "Rotinas financeiras"
  },
  "resumo": "Exemplo — o painel público não mostra valores, contas, notas nem instituições.",
  "exemplo": true,
  "fonte": {
    "tipo": "exemplo",
    "detalhe": "Semente ilustrativa. Nenhum extrato ou planilha é lido."
  },
  "status": "planejado",
  "saude": {
    "motivo": "Exemplo — frente financeira sem fonte automática, de propósito."
  },
  "atualizado_em": null,
  "projetos": [
    {
      "id": "rotina",
      "nome": "Rotina financeira",
      "repo": null,
      "url": null,
      "descricao": "Exemplo — existência da rotina, sem lançamento e sem valor.",
      "status": "preparacao",
      "saude": "planejado",
      "saude_motivo": "Exemplo — fonte ainda não conectada.",
      "progresso": null,
      "ultima_atividade": null,
      "nota": "Exemplo — sem leitura de arquivos.",
      "frentes": [],
      "destaques": []
    }
  ],
  "prazos": [],
  "rotinas": [
    {
      "nome": "Exemplo — conciliação periódica",
      "frequencia": "a definir",
      "ultima_execucao": null,
      "status": "desconhecida",
      "nota": "Exemplo — nenhuma execução real."
    }
  ],
  "aguardando_samuel": [
    {
      "id": "ex-fin-1",
      "titulo": "Exemplo — conciliação periódica pendente",
      "detalhe": "Valores, contas e instituições ficam de fora. O painel só pode dizer que a rotina existe.",
      "desde": null,
      "projeto_id": "rotina",
      "urgencia": "baixa",
      "tipo": "exemplo",
      "link": null
    }
  ],
  "atividade": [],
  "links": [],
  "avisos": [
    "Dados de exemplo. Não representam pedidos reais ao Samuel."
  ]
}
