{
  "$schema": "../schema/modulo.schema.json",
  "id": "sys",
  "nome": "Sys",
  "agente": {
    "id": "sys",
    "nome": "Sys",
    "papel": "TI e infraestrutura"
  },
  "resumo": "Exemplo — rotinas de casa de máquinas. Sem nomes de servidor, usuários ou credenciais.",
  "exemplo": true,
  "fonte": {
    "tipo": "exemplo",
    "detalhe": "Semente ilustrativa. Inventário, log e segredo não são lidos."
  },
  "status": "planejado",
  "saude": {
    "motivo": "Exemplo — TI sem fonte automática."
  },
  "atualizado_em": null,
  "projetos": [
    {
      "id": "casa",
      "nome": "Casa de máquinas",
      "repo": null,
      "url": null,
      "descricao": "Exemplo — rotina de infraestrutura, sem host e sem credencial.",
      "status": "preparacao",
      "saude": "planejado",
      "saude_motivo": "Exemplo — fonte ainda não conectada.",
      "progresso": null,
      "ultima_atividade": null,
      "nota": "Exemplo — sem leitura de arquivos.",
      "frentes": [],
      "destaques": []
    }
  ],
  "prazos": [],
  "rotinas": [
    {
      "nome": "Exemplo — checagem de backup",
      "frequencia": "a definir",
      "ultima_execucao": null,
      "status": "desconhecida",
      "nota": "Exemplo — nenhuma execução real."
    }
  ],
  "aguardando_samuel": [
    {
      "id": "ex-sys-1",
      "titulo": "Exemplo — checagem ilustrativa de backup",
      "detalhe": "Sem nome de servidor, sem usuário e sem segredo.",
      "desde": null,
      "projeto_id": "casa",
      "urgencia": "baixa",
      "tipo": "exemplo",
      "link": null
    }
  ],
  "atividade": [],
  "links": [],
  "avisos": [
    "Dados de exemplo. Não representam pedidos reais ao Samuel."
  ]
}
