{
  "$schema": "../schema/modulo.schema.json",
  "id": "tek-catalog",
  "nome": "Tek Catalog",
  "agente": {
    "id": "tek",
    "nome": "Eng/Tek",
    "papel": "Engenharia: cálculo, documento, modelo e estúdio"
  },
  "resumo": "Tek Catalog — 7 de 31 tarefas concluídas (22,6%). 13 dúvidas de backlog abertas.",
  "exemplo": false,
  "fonte": {
    "tipo": "github",
    "detalhe": "Lido via API do GitHub: docs/BACKLOG.md, docs/DUVIDAS.md e PRs mesclados. Só entram contagens, títulos curtos e datas."
  },
  "status": "saudavel",
  "saude": {
    "motivo": "Entrega em 29/10/2026."
  },
  "atualizado_em": "2026-10-29T11:20:00-03:00",
  "projetos": [
    {
      "id": "catalog",
      "nome": "Tek Catalog",
      "repo": "SamAlencar/tek-catalog",
      "url": "https://github.com/SamAlencar/tek-catalog",
      "descricao": "Catálogo Tekto de materiais da construção civil com IFC 4.3",
      "status": "ativo",
      "saude": "saudavel",
      "saude_motivo": "Entrega em 29/10/2026.",
      "progresso": {
        "feitos": 7,
        "total": 31,
        "percentual": 22.6
      },
      "ultima_atividade": "2026-10-29T11:20:00-03:00",
      "nota": "Ritmo planejado: 1 tarefa/dia. Previsão de término: 2026-11-23.",
      "frentes": [
        {
          "nome": "Etapas",
          "feitos": 7,
          "total": 31,
          "percentual": 22.6
        }
      ],
      "destaques": [
        {
          "id": "TK-008",
          "texto": "Script validar.py (ficha, IFC, IDS, índice); CI só com autorização do Samuel"
        },
        {
          "id": "TK-009",
          "texto": "Guia de busca de modelos do fabricante e regra de licença"
        },
        {
          "id": "TK-010",
          "texto": "Item 01: bloco cerâmico 14×19×29"
        },
        {
          "id": "TK-011",
          "texto": "Item 02: bloco de concreto estrutural 14×19×39"
        }
      ]
    }
  ],
  "prazos": [
    {
      "id": "catalog-previsao",
      "titulo": "Previsão de término no ritmo planejado — Tek Catalog",
      "data": "2026-11-23",
      "projeto_id": "catalog",
      "tipo": "previsao"
    }
  ],
  "rotinas": [
    {
      "nome": "Backlog do Tek Catalog",
      "frequencia": "diária",
      "ultima_execucao": "2026-10-29T11:20:00-03:00",
      "status": "em_dia",
      "nota": "1 tarefa/dia"
    }
  ],
  "aguardando_samuel": [
    {
      "id": "catalog-1",
      "titulo": "Status: decidido por Samuel em 24/10/2026",
      "detalhe": null,
      "desde": null,
      "projeto_id": "catalog",
      "urgencia": "media",
      "tipo": "duvida",
      "link": null
    },
    {
      "id": "catalog-10",
      "titulo": "Decisão: a textura importa e variantes de textura por item são válidas. Só ficam no repo texturas próprias ou de licença livre (CC0), com fonte e licença; imagens de fabricantes f…",
      "detalhe": null,
      "desde": null,
      "projeto_id": "catalog",
      "urgencia": "media",
      "tipo": "duvida",
      "link": null
    },
    {
      "id": "catalog-11",
      "titulo": "Status: decisão provisória do agente em 29/10/2026, para revisão do Samuel",
      "detalhe": null,
      "desde": null,
      "projeto_id": "catalog",
      "urgencia": "media",
      "tipo": "duvida",
      "link": null
    },
    {
      "id": "catalog-12",
      "titulo": "Contexto: o plano pede que o IDS confira os Psets obrigatórios, mas quais Psets e propriedades cada item terá dependem das fontes do item (fabricante, catálogo técnico, norma), qu…",
      "detalhe": null,
      "desde": null,
      "projeto_id": "catalog",
      "urgencia": "media",
      "tipo": "duvida",
      "link": null
    },
    {
      "id": "catalog-2",
      "titulo": "Decisão: itens genéricos, com dimensões normalizadas, e links para os fabricantes.",
      "detalhe": null,
      "desde": null,
      "projeto_id": "catalog",
      "urgencia": "media",
      "tipo": "duvida",
      "link": null
    },
    {
      "id": "catalog-3",
      "titulo": "Status: decidido por Samuel em 24/10/2026",
      "detalhe": null,
      "desde": null,
      "projeto_id": "catalog",
      "urgencia": "media",
      "tipo": "duvida",
      "link": null
    },
    {
      "id": "catalog-4",
      "titulo": "Decisão: guardar somente links (com data de acesso e licença). Nunca guardar arquivos de fabricantes.",
      "detalhe": null,
      "desde": null,
      "projeto_id": "catalog",
      "urgencia": "media",
      "tipo": "duvida",
      "link": null
    },
    {
      "id": "catalog-5",
      "titulo": "Status: decidido por Samuel em 24/10/2026",
      "detalhe": null,
      "desde": null,
      "projeto_id": "catalog",
      "urgencia": "media",
      "tipo": "duvida",
      "link": null
    },
    {
      "id": "catalog-6",
      "titulo": "Decisão: só IFC agora; famílias do Revit depois, via plug-in do Tekto Model.",
      "detalhe": null,
      "desde": null,
      "projeto_id": "catalog",
      "urgencia": "media",
      "tipo": "duvida",
      "link": null
    },
    {
      "id": "catalog-7",
      "titulo": "Status: decidido por Samuel em 24/10/2026",
      "detalhe": null,
      "desde": null,
      "projeto_id": "catalog",
      "urgencia": "media",
      "tipo": "duvida",
      "link": null
    },
    {
      "id": "catalog-8",
      "titulo": "Decisão: sim, rotina diária \"Tek Catalog: uma tarefa por dia\".",
      "detalhe": null,
      "desde": null,
      "projeto_id": "catalog",
      "urgencia": "media",
      "tipo": "duvida",
      "link": null
    },
    {
      "id": "catalog-9",
      "titulo": "Status: decidido por Samuel em 24/10/2026",
      "detalhe": null,
      "desde": null,
      "projeto_id": "catalog",
      "urgencia": "media",
      "tipo": "duvida",
      "link": null
    },
    {
      "id": "catalog-TK-010",
      "titulo": "Decisão provisória: a regra base por categoria confere só classe, PredefinedType (ou ElementType em USERDEFINED), Name e Tag. Cada item, ao ser criado (TK-010 a TK-022), acrescent…",
      "detalhe": null,
      "desde": null,
      "projeto_id": "catalog",
      "urgencia": "media",
      "tipo": "duvida",
      "link": null
    }
  ],
  "atividade": [
    {
      "quando": "2026-10-29T11:20:00-03:00",
      "resumo": "Mesclou em Tek Catalog: TK-007: regras IDS base por categoria",
      "projeto_id": "catalog",
      "link": "https://github.com/SamAlencar/tek-catalog/pull/8"
    }
  ],
  "links": [
    {
      "rotulo": "Tek Catalog",
      "url": "https://github.com/SamAlencar/tek-catalog"
    }
  ],
  "avisos": [
    "Cada projeto mostra no máximo 12 frentes, as de maior volume.",
    "3 trechos omitidos pelo filtro público."
  ]
}
