{
  "$schema": "../schema/modulo.schema.json",
  "id": "tek-hunter",
  "nome": "Tek Hunter",
  "agente": {
    "id": "tek",
    "nome": "Eng/Tek",
    "papel": "Engenharia: cálculo, documento, modelo e estúdio"
  },
  "resumo": "Tek Hunter — 4 de 24 tarefas concluídas (16,7%). 3 dúvidas de backlog abertas.",
  "exemplo": false,
  "fonte": {
    "tipo": "github",
    "detalhe": "Lido via API do GitHub: docs/BACKLOG.md, docs/DUVIDAS.md e PRs mesclados. Só entram contagens, títulos curtos e datas."
  },
  "status": "saudavel",
  "saude": {
    "motivo": "Entrega em 29/10/2026."
  },
  "atualizado_em": "2026-10-29T09:28:00-03:00",
  "projetos": [
    {
      "id": "hunter",
      "nome": "Tek Hunter",
      "repo": "SamAlencar/tek-hunter",
      "url": "https://github.com/SamAlencar/tek-hunter",
      "descricao": "Base para captação de elaboração de projetos",
      "status": "ativo",
      "saude": "saudavel",
      "saude_motivo": "Entrega em 29/10/2026.",
      "progresso": {
        "feitos": 4,
        "total": 24,
        "percentual": 16.7
      },
      "ultima_atividade": "2026-10-29T09:28:00-03:00",
      "nota": "Ritmo planejado: 2 etapas/semana. Previsão de término: 2027-01-09.",
      "frentes": [
        {
          "nome": "Amostra",
          "feitos": 0,
          "total": 7,
          "percentual": 0.0
        },
        {
          "nome": "Fontes",
          "feitos": 3,
          "total": 6,
          "percentual": 50.0
        },
        {
          "nome": "Sínteses",
          "feitos": 0,
          "total": 6,
          "percentual": 0.0
        },
        {
          "nome": "Uso",
          "feitos": 0,
          "total": 3,
          "percentual": 0.0
        },
        {
          "nome": "Convenções",
          "feitos": 1,
          "total": 1,
          "percentual": 100.0
        },
        {
          "nome": "Fechamento",
          "feitos": 0,
          "total": 1,
          "percentual": 0.0
        }
      ],
      "destaques": [
        {
          "id": "TH-005",
          "texto": "Catálogo de diários oficiais e sites municipais"
        },
        {
          "id": "TH-006",
          "texto": "Catálogo de plataformas de freelancer e portais de cotação"
        },
        {
          "id": "TH-007",
          "texto": "Guia da API pública do PNCP"
        },
        {
          "id": "TH-008",
          "texto": "Quadro legal dos documentos de habilitação"
        }
      ]
    }
  ],
  "prazos": [
    {
      "id": "hunter-previsao",
      "titulo": "Previsão de término no ritmo planejado — Tek Hunter",
      "data": "2027-01-09",
      "projeto_id": "hunter",
      "tipo": "previsao"
    }
  ],
  "rotinas": [
    {
      "nome": "Backlog do Tek Hunter",
      "frequencia": "semanal",
      "ultima_execucao": "2026-10-29T09:28:00-03:00",
      "status": "em_dia",
      "nota": "2 etapas/semana"
    }
  ],
  "aguardando_samuel": [
    {
      "id": "hunter-D-001",
      "titulo": "D-001 — Catalogar órgãos de infraestrutura além do portal central de compras?",
      "detalhe": null,
      "desde": null,
      "projeto_id": "hunter",
      "urgencia": "media",
      "tipo": "duvida",
      "link": null
    },
    {
      "id": "hunter-D-002",
      "titulo": "D-002 — Reconferir PI, AP e MT",
      "detalhe": null,
      "desde": null,
      "projeto_id": "hunter",
      "urgencia": "media",
      "tipo": "duvida",
      "link": null
    },
    {
      "id": "hunter-D-003",
      "titulo": "D-003 — Licitanet: aceitar fonte oficial de terceiro?",
      "detalhe": null,
      "desde": null,
      "projeto_id": "hunter",
      "urgencia": "media",
      "tipo": "duvida",
      "link": null
    }
  ],
  "atividade": [],
  "links": [
    {
      "rotulo": "Tek Hunter",
      "url": "https://github.com/SamAlencar/tek-hunter"
    }
  ],
  "avisos": [
    "Cada projeto mostra no máximo 12 frentes, as de maior volume.",
    "2 trechos omitidos pelo filtro público."
  ]
}
