{
  "$schema": "../schema/modulo.schema.json",
  "id": "tek-team",
  "nome": "Tek Team",
  "agente": {
    "id": "tek",
    "nome": "Eng/Tek",
    "papel": "Engenharia: cálculo, documento, modelo e estúdio"
  },
  "resumo": "Tek Team — 14 de 114 tarefas concluídas (12,3%). 17 dúvidas de backlog abertas.",
  "exemplo": false,
  "fonte": {
    "tipo": "github",
    "detalhe": "Lido via API do GitHub: docs/BACKLOG.md, docs/DUVIDAS.md e PRs mesclados. Só entram contagens, títulos curtos e datas."
  },
  "status": "saudavel",
  "saude": {
    "motivo": "Entrega em 30/10/2026."
  },
  "atualizado_em": "2026-10-30T09:55:00-03:00",
  "projetos": [
    {
      "id": "team",
      "nome": "Tek Team",
      "repo": "SamAlencar/tek-team",
      "url": "https://github.com/SamAlencar/tek-team",
      "descricao": "Equipe de agentes de IA: papéis, skills e diretrizes BIM",
      "status": "ativo",
      "saude": "saudavel",
      "saude_motivo": "Entrega em 30/10/2026.",
      "progresso": {
        "feitos": 14,
        "total": 114,
        "percentual": 12.3
      },
      "ultima_atividade": "2026-10-30T09:55:00-03:00",
      "nota": "Ritmo planejado: 1 tarefa/dia. Previsão de término: 2027-02-08.",
      "frentes": [
        {
          "nome": "Papéis",
          "feitos": 1,
          "total": 33,
          "percentual": 3.0
        },
        {
          "nome": "Arsenal",
          "feitos": 0,
          "total": 25,
          "percentual": 0.0
        },
        {
          "nome": "Skills",
          "feitos": 0,
          "total": 12,
          "percentual": 0.0
        },
        {
          "nome": "Fundamentos",
          "feitos": 11,
          "total": 11,
          "percentual": 100.0
        },
        {
          "nome": "Diretrizes",
          "feitos": 1,
          "total": 8,
          "percentual": 12.5
        },
        {
          "nome": "Aplicação",
          "feitos": 0,
          "total": 8,
          "percentual": 0.0
        },
        {
          "nome": "BIM",
          "feitos": 1,
          "total": 6,
          "percentual": 16.7
        },
        {
          "nome": "Piloto",
          "feitos": 0,
          "total": 6,
          "percentual": 0.0
        },
        {
          "nome": "Esquemas",
          "feitos": 0,
          "total": 4,
          "percentual": 0.0
        },
        {
          "nome": "Fechamento",
          "feitos": 0,
          "total": 1,
          "percentual": 0.0
        }
      ],
      "destaques": [
        {
          "id": "TT-013",
          "texto": "Pesquisa: papéis e funções de gestão da informação na ISO 19650"
        },
        {
          "id": "TT-014",
          "texto": "Pesquisa: BEP, EIR/OIR/AIR/PIR e plano de entrega (MIDP/TIDP)"
        },
        {
          "id": "TT-015",
          "texto": "Pesquisa: CDE, estados da informação, nomenclatura e metadados"
        },
        {
          "id": "TT-016",
          "texto": "Pesquisa: níveis de informação necessária, LOD/LOI e IFC 4.3"
        }
      ]
    }
  ],
  "prazos": [
    {
      "id": "team-previsao",
      "titulo": "Previsão de término no ritmo planejado — Tek Team",
      "data": "2027-02-08",
      "projeto_id": "team",
      "tipo": "previsao"
    }
  ],
  "rotinas": [
    {
      "nome": "Backlog do Tek Team",
      "frequencia": "diária",
      "ultima_execucao": "2026-10-30T09:55:00-03:00",
      "status": "em_dia",
      "nota": "1 tarefa/dia"
    }
  ],
  "aguardando_samuel": [
    {
      "id": "team-D-001",
      "titulo": "D-001 — Termos em português da série ISO 19650",
      "detalhe": null,
      "desde": "2026-10-17",
      "projeto_id": "team",
      "urgencia": "media",
      "tipo": "duvida",
      "link": null
    },
    {
      "id": "team-D-002",
      "titulo": "D-002 — Contrato do Tekto Model incompatível com a resposta real do MCP do Tekto Calc",
      "detalhe": null,
      "desde": "2026-10-18",
      "projeto_id": "team",
      "urgencia": "media",
      "tipo": "duvida",
      "link": null
    },
    {
      "id": "team-D-003",
      "titulo": "D-003 — Estado de capacidade quando código e backlog divergem",
      "detalhe": null,
      "desde": "2026-10-18",
      "projeto_id": "team",
      "urgencia": "media",
      "tipo": "duvida",
      "link": null
    },
    {
      "id": "team-D-004",
      "titulo": "D-004 — Organograma de referência e cargos sem código CBO",
      "detalhe": null,
      "desde": "2026-10-19",
      "projeto_id": "team",
      "urgencia": "media",
      "tipo": "duvida",
      "link": null
    },
    {
      "id": "team-D-005",
      "titulo": "D-005 — Áreas disputadas entre CAU e CONFEA",
      "detalhe": null,
      "desde": "2026-10-20",
      "projeto_id": "team",
      "urgencia": "media",
      "tipo": "duvida",
      "link": null
    },
    {
      "id": "team-D-006",
      "titulo": "D-006 — Assinatura de trabalho preparado por agente de IA",
      "detalhe": null,
      "desde": "2026-10-20",
      "projeto_id": "team",
      "urgencia": "media",
      "tipo": "duvida",
      "link": null
    },
    {
      "id": "team-D-007",
      "titulo": "D-007 — Limites dos técnicos industriais: decreto ou resoluções do CFT",
      "detalhe": null,
      "desde": "2026-10-20",
      "projeto_id": "team",
      "urgencia": "media",
      "tipo": "duvida",
      "link": null
    },
    {
      "id": "team-D-008",
      "titulo": "D-008 — Documento do cliente e dado pessoal em serviço de IA de terceiro",
      "detalhe": null,
      "desde": "2026-10-21",
      "projeto_id": "team",
      "urgencia": "media",
      "tipo": "duvida",
      "link": null
    },
    {
      "id": "team-D-009",
      "titulo": "D-009 — Declarar ao cliente o uso de IA",
      "detalhe": null,
      "desde": "2026-10-21",
      "projeto_id": "team",
      "urgencia": "media",
      "tipo": "duvida",
      "link": null
    },
    {
      "id": "team-D-010",
      "titulo": "D-010 — Exemplo mínimo do Cursor testado fora do Cursor",
      "detalhe": null,
      "desde": "2026-10-23",
      "projeto_id": "team",
      "urgencia": "media",
      "tipo": "duvida",
      "link": null
    },
    {
      "id": "team-D-011",
      "titulo": "D-011 — Arquivo canônico de instruções nos repositórios da Tekto",
      "detalhe": null,
      "desde": "2026-10-24",
      "projeto_id": "team",
      "urgencia": "media",
      "tipo": "duvida",
      "link": null
    },
    {
      "id": "team-D-012",
      "titulo": "D-012 — Instalar skills do Tek Team na biblioteca do Grok Bot",
      "detalhe": null,
      "desde": "2026-10-25",
      "projeto_id": "team",
      "urgencia": "media",
      "tipo": "duvida",
      "link": null
    },
    {
      "id": "team-D-013",
      "titulo": "D-013 — Revisor só leitura no Codex",
      "detalhe": null,
      "desde": "2026-10-26",
      "projeto_id": "team",
      "urgencia": "media",
      "tipo": "duvida",
      "link": null
    },
    {
      "id": "team-D-014",
      "titulo": "D-014 — Servidores MCP de terceiros e aprovação automática",
      "detalhe": null,
      "desde": "2026-10-27",
      "projeto_id": "team",
      "urgencia": "media",
      "tipo": "duvida",
      "link": null
    },
    {
      "id": "team-D-015",
      "titulo": "D-015 — Cobertura dos departamentos na Tekto de hoje e ordem do backlog",
      "detalhe": null,
      "desde": "2026-10-28",
      "projeto_id": "team",
      "urgencia": "media",
      "tipo": "duvida",
      "link": null
    },
    {
      "id": "team-D-016",
      "titulo": "D-016 — Situação da NBR ISO 19650-4 e papel da Tekto na equipe ISO 19650",
      "detalhe": null,
      "desde": "2026-10-29",
      "projeto_id": "team",
      "urgencia": "media",
      "tipo": "duvida",
      "link": null
    },
    {
      "id": "team-D-017",
      "titulo": "D-017 — Onde fica o documento do cliente e como barrar segredo em repositório privado",
      "detalhe": null,
      "desde": "2026-10-30",
      "projeto_id": "team",
      "urgencia": "media",
      "tipo": "duvida",
      "link": null
    }
  ],
  "atividade": [
    {
      "quando": "2026-10-30T09:55:00-03:00",
      "resumo": "Mesclou em Tek Team: TT-058 — Segurança, sigilo e dados de clientes",
      "projeto_id": "team",
      "link": "https://github.com/SamAlencar/tek-team/pull/20"
    }
  ],
  "links": [
    {
      "rotulo": "Tek Team",
      "url": "https://github.com/SamAlencar/tek-team"
    }
  ],
  "avisos": [
    "Cada projeto mostra no máximo 12 frentes, as de maior volume.",
    "2 trechos omitidos pelo filtro público."
  ]
}
