{
  "$schema": "../schema/modulo.schema.json",
  "id": "tekto-studio",
  "nome": "Tekto Studio",
  "agente": {
    "id": "tek",
    "nome": "Eng/Tek",
    "papel": "Engenharia: cálculo, documento, modelo e estúdio"
  },
  "resumo": "Tekto Studio: 10 de 37 tarefas concluídas (27%). 0 dúvidas de backlog abertas.",
  "exemplo": false,
  "fonte": {
    "tipo": "github",
    "detalhe": "Lido via API do GitHub: docs/BACKLOG.md, docs/DUVIDAS.md e PRs mesclados. Só entram contagens, títulos curtos e datas."
  },
  "status": "saudavel",
  "saude": {
    "motivo": "Entrega em 24/10/2026."
  },
  "atualizado_em": "2026-10-24T10:39:00-03:00",
  "projetos": [
    {
      "id": "studio",
      "nome": "Tekto Studio",
      "repo": "SamAlencar/tekto-studio",
      "url": "https://github.com/SamAlencar/tekto-studio",
      "descricao": "Plataforma de engenharia com agente de IA e núcleo determinístico",
      "status": "ativo",
      "saude": "saudavel",
      "saude_motivo": "Entrega em 24/10/2026.",
      "progresso": {
        "feitos": 10,
        "total": 37,
        "percentual": 27.0
      },
      "ultima_atividade": "2026-10-24T10:39:00-03:00",
      "nota": "Ritmo planejado: 1 tarefa/dia. Previsão de término: 2026-11-20.",
      "frentes": [
        {
          "nome": "Fase 2 — Integração do núcleo (8)",
          "feitos": 0,
          "total": 8,
          "percentual": 0.0
        },
        {
          "nome": "Fase 0 — Setup (5)",
          "feitos": 5,
          "total": 6,
          "percentual": 83.3
        },
        {
          "nome": "Fase 4 — Laço do agente + memória (6)",
          "feitos": 0,
          "total": 6,
          "percentual": 0.0
        },
        {
          "nome": "Fase 1 — Template de especificação (extração REA) (5)",
          "feitos": 3,
          "total": 5,
          "percentual": 60.0
        },
        {
          "nome": "Fase 3 — Ferramentas via MCP (4)",
          "feitos": 0,
          "total": 4,
          "percentual": 0.0
        },
        {
          "nome": "Fase 5 — Interface (4)",
          "feitos": 0,
          "total": 4,
          "percentual": 0.0
        },
        {
          "nome": "Fase 6 — Log de auditoria (4)",
          "feitos": 2,
          "total": 4,
          "percentual": 50.0
        }
      ],
      "destaques": [
        {
          "id": "TS-006 (bloqueado: TS-D10)",
          "texto": "Dependência do tekto-model (via git, versão fixada; DT-005 do Model)"
        },
        {
          "id": "TS-013 [S]",
          "texto": "Piloto: Samuel roda REA no Robot 2027 e preenche 1 spec da flexão de viga de concreto armado (TS-D06)"
        },
        {
          "id": "TS-014",
          "texto": "Revisão do piloto e ajuste do template"
        },
        {
          "id": "TS-020 (aguarda TS-013: ainda não há sp…",
          "texto": "Mapear specs do Robot contra o que o tekto-calc já tem; listar lacunas"
        }
      ]
    }
  ],
  "prazos": [
    {
      "id": "studio-previsao",
      "titulo": "Previsão de término no ritmo planejado — Tekto Studio",
      "data": "2026-11-20",
      "projeto_id": "studio",
      "tipo": "previsao"
    }
  ],
  "rotinas": [
    {
      "nome": "Backlog do Tekto Studio",
      "frequencia": "diária",
      "ultima_execucao": "2026-10-24T10:39:00-03:00",
      "status": "em_dia",
      "nota": "1 tarefa/dia"
    }
  ],
  "aguardando_samuel": [],
  "atividade": [
    {
      "quando": "2026-10-24T10:39:00-03:00",
      "resumo": "Mesclou em Tekto Studio: TS-061: gravação automática da auditoria",
      "projeto_id": "studio",
      "link": "https://github.com/SamAlencar/tekto-studio/pull/6"
    },
    {
      "quando": "2026-10-23T10:41:00-03:00",
      "resumo": "Mesclou em Tekto Studio: TS-060: esquema do registro JSONL da auditoria",
      "projeto_id": "studio",
      "link": "https://github.com/SamAlencar/tekto-studio/pull/5"
    }
  ],
  "links": [
    {
      "rotulo": "Tekto Studio",
      "url": "https://github.com/SamAlencar/tekto-studio"
    }
  ],
  "avisos": [
    "Cada projeto mostra no máximo 12 frentes, as de maior volume."
  ]
}
