{
  "$schema": "../schema/modulo.schema.json",
  "id": "dark-channel",
  "nome": "Dark Channel",
  "agente": {
    "id": "dar",
    "nome": "Dar",
    "papel": "Canal dark educacional"
  },
  "resumo": "Repositórios visíveis: dark-channel-playbook. Entram só metadados e títulos de commits já filtrados; arquivos e issues não entram no painel.",
  "exemplo": false,
  "fonte": {
    "tipo": "github",
    "detalhe": "Listagem da API do GitHub. Conteúdo de arquivo não é lido nesta frente; títulos de commit passam pelo filtro público."
  },
  "status": "saudavel",
  "saude": {
    "motivo": "Saúde pelo push mais recente (25/10/2026)."
  },
  "atualizado_em": "2026-10-25T12:12:12+00:00",
  "projetos": [
    {
      "id": "dark-channel-playbook",
      "nome": "dark-channel-playbook",
      "repo": "SamAlencar/dark-channel-playbook",
      "url": "https://github.com/SamAlencar/dark-channel-playbook",
      "descricao": "Sem descrição pública.",
      "status": "ativo",
      "saude": "saudavel",
      "saude_motivo": "Último push em 25/10/2026.",
      "progresso": null,
      "ultima_atividade": "2026-10-25T12:12:12+00:00",
      "nota": "Só metadados. Arquivo e issue não são lidos.",
      "frentes": [],
      "destaques": []
    }
  ],
  "prazos": [],
  "rotinas": [],
  "aguardando_samuel": [],
  "atividade": [
    {
      "quando": "2026-10-25T12:12:10+00:00",
      "resumo": "dark-channel-playbook: Passo 01: visão do negócio e modelo multi-canal (YPP, receitas, metas 6/12 meses, ciclo de vida do canal)",
      "projeto_id": "dark-channel-playbook",
      "link": "https://github.com/SamAlencar/dark-channel-playbook"
    },
    {
      "quando": "2026-10-24T23:51:42+00:00",
      "resumo": "dark-channel-playbook: docs: BACKLOG e DUVIDAS para o painel",
      "projeto_id": "dark-channel-playbook",
      "link": "https://github.com/SamAlencar/dark-channel-playbook"
    },
    {
      "quando": "2026-10-24T19:22:11+00:00",
      "resumo": "dark-channel-playbook: TTS: OmniVoice principal; F5-TTS e TTSMaker alternativas; Piper removido",
      "projeto_id": "dark-channel-playbook",
      "link": "https://github.com/SamAlencar/dark-channel-playbook"
    },
    {
      "quando": "2026-10-24T19:11:58+00:00",
      "resumo": "dark-channel-playbook: RunPod Serverless como parte planejada do pipeline: passos 34-36, orçamento/alertas, fallback local",
      "projeto_id": "dark-channel-playbook",
      "link": "https://github.com/SamAlencar/dark-channel-playbook"
    },
    {
      "quando": "2026-10-24T19:11:04+00:00",
      "resumo": "dark-channel-playbook: Pipeline híbrido documentado e avaliado; PLANO 51 passos; trilhas visuais e render_nuvem no template",
      "projeto_id": "dark-channel-playbook",
      "link": "https://github.com/SamAlencar/dark-channel-playbook"
    }
  ],
  "links": [
    {
      "rotulo": "dark-channel-playbook",
      "url": "https://github.com/SamAlencar/dark-channel-playbook"
    }
  ],
  "avisos": [
    "Issues e arquivos não são lidos. Esta frente não leva valor, cliente nem conteúdo interno."
  ]
}
