{
  "$schema": "../schema/modulo.schema.json",
  "id": "4medco",
  "nome": "4med.co",
  "agente": {
    "id": "bil",
    "nome": "Bil",
    "papel": "Produtos e operação da 4med.co"
  },
  "resumo": "Repositório ativo: 4medco-base-conhecimento. 7 de 18 tarefas da etapa 4 concluídas (38,9%). Em espera: 4medco-platform, 4medco-website.",
  "exemplo": false,
  "fonte": {
    "tipo": "github",
    "detalhe": "API do GitHub: checklist planejamento/etapa4-plano.md de 4medco-base-conhecimento (só contagem e títulos curtos filtrados) e metadados dos demais repositórios."
  },
  "status": "saudavel",
  "saude": {
    "motivo": "Último push em 27/10/2026."
  },
  "atualizado_em": "2026-10-27T12:08:07+00:00",
  "projetos": [
    {
      "id": "4medco-base-conhecimento",
      "nome": "4medco-base-conhecimento",
      "repo": "SamAlencar/4medco-base-conhecimento",
      "url": "https://github.com/SamAlencar/4medco-base-conhecimento",
      "descricao": "Base de conhecimento e planejamento do 4med.co (med-hub): escopo, funcionalidades, MCPs e conteúdo contábil/jurídico",
      "status": "ativo",
      "saude": "saudavel",
      "saude_motivo": "Último push em 27/10/2026.",
      "progresso": {
        "feitos": 7,
        "total": 18,
        "percentual": 38.9
      },
      "ultima_atividade": "2026-10-27T12:08:07+00:00",
      "nota": "Progresso do checklist planejamento/etapa4-plano.md (uma tarefa por dia útil).",
      "frentes": [
        {
          "nome": "Etapa 4",
          "feitos": 7,
          "total": 18,
          "percentual": 38.9
        }
      ],
      "destaques": [
        {
          "id": "T08",
          "texto": "T08 (qua 28/10): Distribuição de lucros e Lei 15.270/2025"
        },
        {
          "id": "T09",
          "texto": "T09 (qui 29/10): Tabelas estruturadas: Presumido, INSS, IRRF e ISS municipal"
        },
        {
          "id": "T10",
          "texto": "T10 (sex 30/10): NFS-e de plantão e retenções"
        },
        {
          "id": "T11",
          "texto": "T11 (ter 03/11): IRPF do médico, carnê-leão e Livro-Caixa"
        }
      ]
    },
    {
      "id": "4medco-platform",
      "nome": "4medco-platform",
      "repo": "SamAlencar/4medco-platform",
      "url": "https://github.com/SamAlencar/4medco-platform",
      "descricao": "plataforma de suporte ao cliente",
      "status": "pausado",
      "saude": "planejado",
      "saude_motivo": "Em espera. Último push em 17/02/2026.",
      "progresso": null,
      "ultima_atividade": "2026-02-17T02:37:06+00:00",
      "nota": "Em espera; só metadados.",
      "frentes": [],
      "destaques": []
    },
    {
      "id": "4medco-website",
      "nome": "4medco-website",
      "repo": "SamAlencar/4medco-website",
      "url": "https://github.com/SamAlencar/4medco-website",
      "descricao": "Sem descrição pública.",
      "status": "pausado",
      "saude": "planejado",
      "saude_motivo": "Em espera. Último push em 26/12/2025.",
      "progresso": null,
      "ultima_atividade": "2025-12-26T00:31:32+00:00",
      "nota": "Em espera; só metadados.",
      "frentes": [],
      "destaques": []
    }
  ],
  "prazos": [],
  "rotinas": [],
  "aguardando_samuel": [],
  "atividade": [
    {
      "quando": "2026-10-26T12:09:42+00:00",
      "resumo": "4medco-base-conhecimento: Etapa 4, T06: ISS e sociedade uniprofissional (STF Tema 918 confirmado, STJ Tema 1.323, SP/DF/BH 2026); glossário 66 termos",
      "projeto_id": "4medco-base-conhecimento",
      "link": "https://github.com/SamAlencar/4medco-base-conhecimento"
    },
    {
      "quando": "2026-10-23T12:04:58+00:00",
      "resumo": "4medco-base-conhecimento: Etapa 4, T05: Lucro Presumido e equiparação hospitalar (IN RFB 2.343/2026, LC 224/2025); glossário 61 termos",
      "projeto_id": "4medco-base-conhecimento",
      "link": "https://github.com/SamAlencar/4medco-base-conhecimento"
    },
    {
      "quando": "2026-10-23T09:52:19+00:00",
      "resumo": "4medco-base-conhecimento: T04: tabelas estruturadas do Simples Nacional (dados JSON e conferência)",
      "projeto_id": "4medco-base-conhecimento",
      "link": "https://github.com/SamAlencar/4medco-base-conhecimento"
    },
    {
      "quando": "2026-10-23T09:51:02+00:00",
      "resumo": "4medco-base-conhecimento: T04: tabelas estruturadas do Simples Nacional (Anexos III e V 2026 e 2027-2028, limites)",
      "projeto_id": "4medco-base-conhecimento",
      "link": "https://github.com/SamAlencar/4medco-base-conhecimento"
    },
    {
      "quando": "2026-02-17T02:36:30+00:00",
      "resumo": "4medco-platform: chore: admin settings, secrets, Cloudflare/Gemini cards, Edge Functions e migrations",
      "projeto_id": "4medco-platform",
      "link": "https://github.com/SamAlencar/4medco-platform"
    },
    {
      "quando": "2026-02-10T15:41:46+00:00",
      "resumo": "4medco-platform: feat: legal docs, referrals, insurance and RLS updates",
      "projeto_id": "4medco-platform",
      "link": "https://github.com/SamAlencar/4medco-platform"
    },
    {
      "quando": "2026-01-09T05:52:40+00:00",
      "resumo": "4medco-platform: feat: remover logo do escritório e sincronizar dados reais da aba informações",
      "projeto_id": "4medco-platform",
      "link": "https://github.com/SamAlencar/4medco-platform"
    },
    {
      "quando": "2026-01-03T02:44:14+00:00",
      "resumo": "4medco-platform: feat: implementar sistema unificado de assinaturas de seguros e melhorias",
      "projeto_id": "4medco-platform",
      "link": "https://github.com/SamAlencar/4medco-platform"
    },
    {
      "quando": "2026-01-02T17:47:33+00:00",
      "resumo": "4medco-platform: feat: melhorias de responsividade mobile e ajustes de UI - Ajustes de responsividade para mobile em cards, botões e componentes - Melhorias na topbar mobile com logo como botão - Ajustes em component…",
      "projeto_id": "4medco-platform",
      "link": "https://github.com/SamAlencar/4medco-platform"
    },
    {
      "quando": "2025-12-19T03:34:54+00:00",
      "resumo": "4medco-website: feat: implementar pÃ¡ginas pÃºblicas e roteamento",
      "projeto_id": "4medco-website",
      "link": "https://github.com/SamAlencar/4medco-website"
    },
    {
      "quando": "2025-12-19T03:34:43+00:00",
      "resumo": "4medco-website: feat: adicionar componentes pÃºblicos do website",
      "projeto_id": "4medco-website",
      "link": "https://github.com/SamAlencar/4medco-website"
    },
    {
      "quando": "2025-12-19T03:34:39+00:00",
      "resumo": "4medco-website: feat: adicionar serviÃ§o Stripe para checkout",
      "projeto_id": "4medco-website",
      "link": "https://github.com/SamAlencar/4medco-website"
    }
  ],
  "links": [
    {
      "rotulo": "4medco-base-conhecimento",
      "url": "https://github.com/SamAlencar/4medco-base-conhecimento"
    },
    {
      "rotulo": "4medco-platform",
      "url": "https://github.com/SamAlencar/4medco-platform"
    },
    {
      "rotulo": "4medco-website",
      "url": "https://github.com/SamAlencar/4medco-website"
    }
  ],
  "avisos": [
    "Só entram contagem e títulos de tarefa filtrados. Esta frente não leva valor, cliente nem conteúdo interno."
  ]
}
